### ISSUE TITLE
Pika cannot handle tcpkill command. 'NoneType' is not catched in Pika library - particularly in File "/usr/local/lib/python2.7/dist-packages/pika-0.9.5-py2.7.egg/pika/adapters/base_connection.py", in function "def _handle_error(self, error):"

### ISSUE THREAD

**Issue by lockonoko** [pika/pika#122]
I wrote the python program to send and receive messages to/from amq server using Simple Reconnection Strategy as followed:

In main function:

```
if __name__ == '__main__':      
    def post_heartbeat():
    heartbeat(d2l_agent)
    Timer(300.0, post_heartbeat).start()    # Send a 'heartbeat' to the queue every 30 minutes

post_heartbeat()

fetch_job(d2l_agent)
exit(0)`
```

---

heartbeat(_) is a global function to send messages to amq server. It is defined in d2lAgentPublish.py as followed:

```
from pika.adapters import SelectConnection
from pika.reconnection_strategies import SimpleReconnectionStrategy
import pika
import time

# Create a global channel variable to hold our channel object in
channel = agent = connection = queue = None
# Step #2
def on_connected(new_connection):
    """Called when we are fully connected to RabbitMQ"""
    global agent, connection
    connection = new_connection
    # Open a channel
    agent.log.info('on_connected(): connected to host: ' + agent.mq_hostname)
    new_connection.channel(on_channel_open)

# Step #3
def on_channel_open(new_channel):
    """Called when our channel has opened"""
    global channel, agent
    agent.log.info('on_channel_open(): opened channel to RabbitMQ host: ' + agent.mq_hostname + ', declaring queue: ' + agent.mq_queue)
    channel = new_channel

    channel.exchange_declare(exchange=agent.mq_exchange, type='direct')

    channel.queue_declare(queue=agent.mq_queue, durable=True, exclusive=False, auto_delete=False, callback=on_queue_declared)

def on_close(connection):
    global agent
    agent.log.info('on_close(): closed connection to RabbitMQ')
    while connection.is_open:
        time.sleep(1)
        agent.log.info('on_close(): sleeping one second waiting for connection to close')

def on_queue_declared(frame):
    """Called when RabbitMQ has told us our Queue has been declared, frame is the response from RabbitMQ"""
    global agent, connection
    publish_properties = pika.BasicProperties(
        content_type='text/plain', delivery_mode = 1)
    timestamp = int(time.time())
    msg = 'heartbeat: ' + str(timestamp)

    agent.log.info('on_queue_declared(): Publishing to MQ: ' + agent.mq_queue + ', message: ' + msg)
    channel.queue_bind(exchange = agent.mq_exchange, queue = agent.mq_queue, routing_key = agent.mq_queue)

    channel.basic_publish(
        exchange = agent.mq_exchange,
        routing_key = agent.mq_queue,
        properties = publish_properties,
        body = msg )

    agent.log.info('on_queue_declared(): calling close()')
    connection.close()
# Step #4
# Step #5
def handle_delivery(channel, method, header, body):
    """Called when we receive a message from RabbitMQ"""
    print body

def heartbeat(d2l_agent):
    # Step #1: Connect to RabbitMQ
    global agent

    agent = d2l_agent

    credentials = pika.PlainCredentials( agent.mq_username, agent.mq_password)

    parameters = pika.ConnectionParameters(
        host = agent.mq_hostname,
        credentials = credentials,
        virtual_host = agent.mq_vhost )

    agent.log.info('heartbeat(): connection to host: ' + agent.mq_hostname + ', params: ' + str(parameters) )
    srs = SimpleReconnectionStrategy()
    connection = SelectConnection(parameters, on_open_callback=on_connected, reconnection_strategy=srs)
    connection.add_on_close_callback(on_close)
    connection.ioloop.start()
```

---

fetch_job(_) is a global function to receive messages from amq server. It is defined in d2lAgentConsume.py as followed:

```
from pika.adapters import SelectConnection
from pika.reconnection_strategies import SimpleReconnectionStrategy
import pika
import sys
import traceback
import time
'''
    Continuation passing style setup for RabbitMQ initialization
'''
# Create a global channel variable to hold our channel object in
channel = agent = None

def on_connected(connection):
    """Called when we are fully connected to RabbitMQ"""
    # Open a channel
    connection.channel(on_channel_open)

# Step #3
def on_channel_open(new_channel):
    """Called when our channel has opened"""
    global channel
    channel = new_channel
    channel.basic_qos(prefetch_count = 1)
    channel.queue_declare(queue=agent.mq_queue, durable=True, exclusive=False, auto_delete=False, callback=on_queue_declared)

# Step #4
def on_queue_declared(frame):
    """Called when RabbitMQ has told us our Queue has been declared, frame is the response from RabbitMQ"""
    channel.basic_consume(on_message_receipt, queue=agent.mq_queue)

# Step #5

def on_message_receipt(channel, method, header, job_uuid):
    try:
        agent.log.info( '(): queue: ' + agent.mq_queue + ', received body: ' + str(job_uuid) )

        if (str(job_uuid).startswith('heartbeat')):
            agent.log.info( "(): ACKing: " + str(job_uuid) )
            channel.basic_ack(delivery_tag = method.delivery_tag)
            time.sleep(15)
            return  # Ignore heartbeats

        agent.log.info( "on_message_receipt(): received job: " + job_uuid )

        if agent.action == 'provision':
            if agent.d2l_provision( job_uuid):
                agent.log.info( "on_message_receipt(): acked provision job: " + job_uuid )
                channel.basic_ack(delivery_tag = method.delivery_tag)
            else:
                agent.log.info( "on_message_receipt(): nacked provision job: " + job_uuid )
                channel.basic_reject(delivery_tag = method.delivery_tag, requeue = True)    # Return job to the queue
        else:
            if agent.d2l_chpasswd(job_uuid):
                channel.basic_ack(delivery_tag = method.delivery_tag)
                agent.log.info( "on_message_receipt(): acked password job: " + job_uuid )
            else:
                channel.basic_reject(delivery_tag = method.delivery_tag, requeue = True)    # Return job to the queue
                agent.log.info( "on_message_receipt(): nacked password job: " + job_uuid )

        agent.log.info( "on_message_receipt(): finished processing job: " + job_uuid )
    except Exception as e:
        exc_type, exc_value, exc_traceback = sys.exc_info()
        agent.log.error( "on_message_receipt(): ERROR: Received exception: " + str(e) 
                        + repr(traceback.format_exception(exc_type, exc_value, exc_traceback)) )

def fetch_job(d2l_agent):
    global agent
    agent = d2l_agent
    agent.log.info('post_job(): MQ Parameter setup')
    credentials = pika.PlainCredentials( agent.mq_username, agent.mq_password)

    parameters = pika.ConnectionParameters(
        host = agent.mq_hostname,
        credentials = credentials,
        virtual_host = agent.mq_vhost)
        #heartbeat = True

    agent.log.info('post_job(): Setting-up connection, host: ' + agent.mq_hostname )

    # Step #1: Connect to RabbitMQ
    srs = SimpleReconnectionStrategy()
    connection = SelectConnection(parameters, on_open_callback=on_connected, reconnection_strategy=srs)
    try:
        # Loop so we can communicate with RabbitMQ
        connection.ioloop.start()
    except KeyboardInterrupt:
        # Gracefully close the connection
        connection.close()
        # Loop until we're fully closed, will stop on its own
        connection.ioloop.start()
```

---

I run the python program in console and then use netstat to check the sender port on client. The result is like this:

locngo@ubuntu:~$ netstat | grep ESTABLISHED | grep amqp
tcp      126      0 ubuntu:37013            itabashi.oit.pdx.e:amqp ESTABLISHED

Then I use tcpkill to release that port on client as well as kill the tcp connection between receiver and amq server.

locngo@ubuntu:~$ sudo tcpkill -i wlan0 port 37013
tcpkill: listening on wlan0 [port 37013]
131.252.247.168:37013 > 131.252.122.203:5672: R 812871757:812871757(0) win 0
131.252.247.168:37013 > 131.252.122.203:5672: R 812871865:812871865(0) win 0
131.252.247.168:37013 > 131.252.122.203:5672: R 812872081:812872081(0) win 0
131.252.122.203:5672 > 131.252.247.168:37013: R 665772226:665772226(0) win 0
131.252.122.203:5672 > 131.252.247.168:37013: R 665772272:665772272(0) win 0
131.252.122.203:5672 > 131.252.247.168:37013: R 665772364:665772364(0) win 0

Then I came back the python program console to see the result:

locngo@ubuntu:~/workspace/ragve/branches/TRY-DVG-puka/lib/python$ python D2LAgent.py -s -p
2012-02-10 11:02:56,808 - ragve.d2lagent.ses.password - INFO - heartbeat(): connection to host: itabashi.oit.pdx.edu, params: <pika.connection.ConnectionParameters object at 0xb726656c>
2012-02-10 11:02:56,838 - ragve.d2lagent.ses.password - INFO - on_connected(): connected to host: itabashi.oit.pdx.edu
2012-02-10 11:02:56,840 - ragve.d2lagent.ses.password - INFO - on_channel_open(): opened channel to RabbitMQ host: itabashi.oit.pdx.edu, declaring queue: destiny_d2l_ses_password_test
2012-02-10 11:02:56,843 - ragve.d2lagent.ses.password - INFO - on_queue_declared(): Publishing to MQ: destiny_d2l_ses_password_test, message: heartbeat: 1328900576
2012-02-10 11:02:56,843 - ragve.d2lagent.ses.password - INFO - on_queue_declared(): calling close()
2012-02-10 11:02:56,847 - ragve.d2lagent.ses.password - INFO - on_close(): closed connection to RabbitMQ
2012-02-10 11:02:56,847 - ragve.d2lagent.ses.password - INFO - post_job(): MQ Parameter setup
2012-02-10 11:02:56,847 - ragve.d2lagent.ses.password - INFO - post_job(): Setting-up connection, host: itabashi.oit.pdx.edu
2012-02-10 11:02:56,866 - ragve.d2lagent.ses.password - INFO - (): queue: destiny_d2l_ses_password_test, received body: heartbeat: 1328813024
2012-02-10 11:02:56,866 - ragve.d2lagent.ses.password - INFO - (): ACKing: heartbeat: 1328813024
2012-02-10 11:03:11,873 - ragve.d2lagent.ses.password - INFO - (): queue: destiny_d2l_ses_password_test, received body: heartbeat: 1328813468
2012-02-10 11:03:11,873 - ragve.d2lagent.ses.password - INFO - (): ACKing: heartbeat: 1328813468
2012-02-10 11:03:26,885 - ragve.d2lagent.ses.password - INFO - (): queue: destiny_d2l_ses_password_test, received body: heartbeat: 1328813494
2012-02-10 11:03:26,885 - ragve.d2lagent.ses.password - INFO - (): ACKing: heartbeat: 1328813494
2012-02-10 11:03:41,899 - ragve.d2lagent.ses.password - INFO - (): queue: destiny_d2l_ses_password_test, received body: heartbeat: 1328813528
2012-02-10 11:03:41,899 - ragve.d2lagent.ses.password - INFO - (): ACKing: heartbeat: 1328813528
2012-02-10 11:03:56,915 - ragve.d2lagent.ses.password - INFO - (): queue: destiny_d2l_ses_password_test, received body: heartbeat: 1328813649
2012-02-10 11:03:56,915 - ragve.d2lagent.ses.password - INFO - (): ACKing: heartbeat: 1328813649
2012-02-10 11:04:11,931 - ragve.d2lagent.ses.password - INFO - (): queue: destiny_d2l_ses_password_test, received body: heartbeat: 1328830506
2012-02-10 11:04:11,931 - ragve.d2lagent.ses.password - INFO - (): ACKing: heartbeat: 1328830506
2012-02-10 11:04:26,936 - ragve.d2lagent.ses.password - INFO - (): queue: destiny_d2l_ses_password_test, received body: heartbeat: 1328830606
2012-02-10 11:04:26,937 - ragve.d2lagent.ses.password - INFO - (): ACKing: heartbeat: 1328830606
_Traceback (most recent call last):
  File "D2LAgent.py", line 464, in <module>
    fetch_job(d2l_agent)
  File "/home/locngo/workspace/ragve/branches/TRY-DVG-puka/lib/python/mq/d2lAgentConsume.py", line 108, in fetch_job
    connection.ioloop.start()
  File "/usr/local/lib/python2.7/dist-packages/pika-0.9.5-py2.7.egg/pika/adapters/select_connection.py", line 125, in start
    self.poller.start()
  File "/usr/local/lib/python2.7/dist-packages/pika-0.9.5-py2.7.egg/pika/adapters/select_connection.py", line 378, in start
    self.poll()
  File "/usr/local/lib/python2.7/dist-packages/pika-0.9.5-py2.7.egg/pika/adapters/select_connection.py", line 397, in poll
    self._handler(events[0][0], events[0][1])
  File "/usr/local/lib/python2.7/dist-packages/pika-0.9.5-py2.7.egg/pika/adapters/base_connection.py", line 143, in _handle_events
    self._handle_error(error)
  File "/usr/local/lib/python2.7/dist-packages/pika-0.9.5-py2.7.egg/pika/adapters/base_connection.py", line 108, in _handle_error
    error_code = error[0]  # Python <= 2.5
TypeError: 'NoneType' object is not subscriptable_
2012-02-10 11:07:56,848 - ragve.d2lagent.ses.password - INFO - heartbeat(): connection to host: itabashi.oit.pdx.edu, params: <pika.connection.ConnectionParameters object at 0xb771672c>
2012-02-10 11:07:56,860 - ragve.d2lagent.ses.password - INFO - on_connected(): connected to host: itabashi.oit.pdx.edu
2012-02-10 11:07:56,864 - ragve.d2lagent.ses.password - INFO - on_channel_open(): opened channel to RabbitMQ host: itabashi.oit.pdx.edu, declaring queue: destiny_d2l_ses_password_test
2012-02-10 11:07:56,872 - ragve.d2lagent.ses.password - INFO - on_queue_declared(): Publishing to MQ: destiny_d2l_ses_password_test, message: heartbeat: 1328900876
2012-02-10 11:07:56,873 - ragve.d2lagent.ses.password - INFO - on_queue_declared(): calling close()
2012-02-10 11:07:56,879 - ragve.d2lagent.ses.password - INFO - on_close(): closed connection to RabbitMQ

The sender thread was crashed and closed unexpectedly. But the receiver thread is still working.

I solved this problem by intervening the pika library source code but I need a solution which doesn't change anything in the pika library to ensure the encapsulation.
